{
    "$schema": "https://raw.githubusercontent.com/musi-lang/musi/refs/heads/main/schemas/musi.schema.v1.json",
    "name": "@std/bytes",
    "version": "0.1.0",
    "description": "Byte array utilities.",
    "exports": {
        ".": "./mod.ms",
        "./concat": "./concat.ms",
        "./copy": "./copy.ms",
        "./equals": "./equals.ms",
        "./starts_with": "./starts_with.ms"
    }
}
